{
  "version": "1.0.0",
  "name": "hello-world",
  "services": [
    {
      "src": "functions/hello-world.ts"
    }
  ],
  "pricingPlans": [
    {
      "name": "Free",
      "slug": "free",
      "amount": 0,
      "rateLimit": {
        "requestsInterval": "1h",
        "requestsMaxPerInterval": 25
      }
    },
    {
      "name": "Unlimited",
      "slug": "unlimited",
      "amount": 99,
      "rateLimit": null
    }
  ]
}
